milestone,claim_type,primary_artifact,status,implication
M16-local-spectral-window-corollaries,proved from Kim--Tao,docs/proof_ledger/local_window_from_rigidity.md,validated,Inherited global Weyl/rigidity estimates control only windows above endpoint-subtraction scales.
M17-local-window-variance-input,conditional theorem template,docs/proof_ledger/local_window_variance_input.md,validated,Endpoint-beating local windows need a direct smoothed-window variance saving.
M18-test-function-localization-feasibility,analytic obstruction,docs/proof_ledger/test_function_localization_feasibility.md,validated,Retuning Kim--Tao's original test functions is not enough; trace-side localization is the plausible route.
M19-smoothed-window-paley-wiener-lemma,analytic obstruction,docs/proof_ledger/smoothed_window_paley_wiener_obstruction.md,validated,"Bulk window Delta=n^-d requires polynomial support q=n^eta with eta>=d, and small leakage needs eta>d."
M20-long-support-trace-variance-requirement,conditional theorem template,docs/proof_ledger/long_support_trace_variance_requirement.md,validated,Long-support trace variance must beat a beta-saving budget once polynomial support is accepted.
M21-trace-side-long-support-variance-template,conditional theorem template,docs/proof_ledger/trace_side_long_support_variance_template.md,validated,"The fixed-energy trace-side theorem LSTV_trace(eta,beta) is sufficient if beta>2 kappa eta+2d-1."
M22-trace-corollary34-uniform-coefficient-variation-target,open theorem,docs/proof_ledger/trace_corollary34_localized_numerator_target.md,validated,The variance theorem reduces upstream to localized Corollary 3.4 numerator control for the actual Q family.
M23-localized-trace-numerator-quotient-family-model,toy/proxy evidence,docs/proof_ledger/localized_trace_numerator_quotient_family_model.md,validated,Proxy quotient-family growth dominates absent extra damping; unknown surface-group rows remain outside toy certification.
M24-localized-transform-geodesic-weight-decay-obstruction,analytic obstruction,docs/proof_ledger/localized_transform_geodesic_weight_decay.md,validated,"Compact-support transform/geodesic weights do not supply M23's optimistic damping; decay is in t delta_r, not t."
